荆州市第一人民医院（长江大学附属第一医院）,湖北省荆州市沙市区航空路8号,112.25377077612934,30.31106303646784
荆州市第一人民医院慈济分院（荆州市肿瘤医院）,湖北省荆州市金龙路40号,112.22484259019396,30.331284300257654
荆州市妇幼保健院（荆州市儿童保健中心）,湖北省荆州市荆中路203号,112.17194035621958,30.354611436544147
荆州市中心医院,湖北省荆州市荆中路72号,112.18839803573006,30.357246477479972
荆州市中医医院,湖北省荆州市江津东路172号,112.26774354110556,30.31289861086773
荆州市中医院,湖北荆州市江津东路172号,112.26774354110556,30.31289861086773
三峡大学葛洲坝中心医院,湖北省宜昌市樵湖一路60号,111.28051938150593,30.721136514180415
三峡大学仁和医院,湖北省宜昌市夷陵大道410号,111.34696256741164,30.6464074360456
十堰市人民医院（郧阳医学院附属人民医院）,湖北省十堰市朝阳中路39号,110.77632161654677,32.6459884553931
十堰市太和医院（郧阳医学院附属太和医院）,湖北省十堰市人民南路29号,110.77439453888061,32.62415297626825
十堰市中医院,湖北省十堰市丹江路24号,110.8134704350338,32.591008711996466
太和医院,湖北省十堰市人民南路29号,110.77439453888061,32.62415297626825
武钢总医院,湖北省武汉市青山区冶金大道29号,114.39752636931605,30.634335632003168
武汉大学口腔医院,湖北省武汉市洪山区珞喻路237号,114.36061984757409,30.523996867674683
武汉大学人民医院（武汉大学第一临床学院）,湖北省武汉市武昌紫阳路99号,114.2939245980708,30.537660609486952
武汉大学中南医院（湖北医学院附属第二医院、湖北医科大学附属第二医院、武汉大学第二临床学院）,湖北省武汉市武昌区东湖路169号,114.34715164015672,30.555454950088823
武汉大学中山医院,湖北省武汉市中山大道26号,114.24926444672784,30.572619761518467
武汉精神卫生中心,湖北省武汉市硚口游艺路70号,114.26889608471936,30.57707567229752
武汉军工总医院,湖北省武汉市中山大道26号,114.24868456661277,30.571640990834112
武汉科技大学附属天佑医院,湖北省武汉市武昌丁字桥涂家岭9号,114.32093559604218,30.527045864788143
武汉科技大学附属医院,湖北省武汉市武昌区涂家岭9号,114.32093559604218,30.527045864788143
武汉老年病医院,湖北省武汉市洪山区东湖东路17号,114.39020934675929,30.539272251016104
武汉市传染病医院,湖北省武汉市汉口江汉北路18号,114.27417916632099,30.591383357712598
武汉市第二医院,湖北省武汉市江岸区汉口胜利街,114.30145998628159,30.601854807176146
武汉市第三医院（武汉市同仁医院）,湖北省武汉市武昌区彭刘杨路241号；武汉市洪山区关山路一号,114.29718674760579,30.542693704027407
武汉市第四医院（武汉市骨科医院、华中科技大学同济医学院附属普爱医院）,东院区:武汉市硚口区汉正街473号，西院区:硚口区解放大道76号,114.26344761182645,30.567268972659196
武汉市第一医院,湖北省武汉市中山大道215号,114.26660975542747,30.57459050171801
武汉市儿童医院,湖北省武汉市汉口球场路213号,114.28203872291532,30.605102850519287
武汉市妇女儿童医疗保健中心,湖北省武汉市江岸区香港路100号,114.28291464021358,30.605825548655144
武汉市精神病医院,湖北省武汉市桥口区游艺路70号,114.26921596935905,30.577398081936952
武汉市三医院,湖北省武汉市武昌区彭刘杨路273号,114.29763194217738,30.54317364096136
武汉市医疗救治中心,湖北省武汉市东西湖区银潭路1号,114.27956793265403,30.6692329762081
武汉市中西医结合医院,湖北省武汉市中山大道215号,114.26660975542747,30.57459050171801
武汉市中心医院（华中科技大学同济医学院附属武汉中心医院）,湖北省武汉市江岸区胜利街26号,114.28948613649774,30.583591019403706
武汉市中医医院,湖北省武汉汉口黎黄陂路49号,114.28901159523998,30.575851823639926
武汉市中医院,湖北省武汉汉口黎黄陂路49号,114.28901159523998,30.575851823639926
武汉同济医院（华中科技大学同济医学院附属同济医院）,湖北省武汉市解放大道1095号,114.25535348473005,30.582029630419207
武汉协和医院（华中科技大学同济医学院附属协和医院）,湖北省武汉市解放大道1277号,114.26937317646045,30.586686413018572
武汉亚洲心脏病医院,湖北武汉市京汉大道753号,114.27690602129518,30.585437816068307
武警湖北总队医院,湖北省武汉市武昌区民主路475号,114.30782792948908,30.54668230853144
咸宁市人民医院,湖北省咸宁市温泉镇温泉路39号,114.32819588500197,29.827322872559815
咸宁市中心医院,湖北省咸宁市温泉路39号,114.33061982052972,29.828616423251695
咸宁学院附属第二医院,湖北省咸宁市温泉马桥路32号,114.34129701248013,29.82861128955485
咸宁医学院附属第一医院,湖北省咸宁市温泉路39号,114.32146852602519,29.830490991005654
襄樊市第一人民医院（襄樊市红十字医院）,湖北省襄樊市解放路75号,112.54850708068517,29.90467195039358
襄樊市中心医院,湖北省襄樊市襄城区荆州街39号,112.1488067229588,32.02077145724964
襄樊市中医医院,湖北省襄樊市长征路85号,112.14916078906153,32.04961680879177
襄樊市中医院,湖北省襄樊市长征路85号,112.14916078906153,32.04961680879177
孝感市（中心）人民医院,湖北省孝感市城关广埸街广埸路6号,114.11731201869114,31.576657025164156
孝感市中心医院,湖北省孝感市广场路6号,113.90664715728718,30.930978581072722
宜昌市第二人民医院（宜昌市肿瘤医院）,湖北省宜昌市西陵一路58号,111.27904083060255,30.705926131448187
宜昌市第一人民医院,湖北省宜昌市湖堤街4号,111.28328690543046,30.697394337874346
宜昌市中心人民医院,湖北省宜昌市夷陵区大道,111.05378927756063,30.843546504730096
宜昌市中心医院,湖北省宜昌市夷陵路127号,111.28571293261992,30.710133409298898
宜昌市中医院（宜昌市中西医结合医院）,湖北省宜昌市胜利三路2号,111.29355144640175,30.687845291638162
中国第一冶金建设公司职工医院,湖北省武汉市青山区建设四路本溪街1号,114.38597410573217,30.634961368081928
中国人民解放军第一六一中心医院,汉口黄浦路68号(长江二桥北桥头),115.54420933607925,39.72857033177495
中国人民解放军四五七医院（空军汉口医院）,湖北省武汉市江岸区工农兵路15号,114.3009917620312,30.622556192639692
中国石化集团江汉石油管理局中心医院,湖北省潜江市安康路3号,112.69689336527233,30.4440736952157
长沙第一医院,湖南省长沙市第一医院,113.0751277508168,28.249172557242122
长沙市按摩医院,湖南省长沙市人民中路348号,112.9943094977956,28.18870067355845
长沙市第七医院,湖南省长沙市五一东路39号,112.99570131750463,28.19931542058857
长沙市第三医院,湖南省长沙市劳动西路176号,112.97193211907386,28.178709601499158
长沙市第四医院,湖南省长沙市麓山路70号,112.94409351796703,28.19762765930885
长沙市第一人民医院,湖南省长沙市营盘路311号,112.9699319977073,28.204459225852062
常德市第一人民医院,湖南省常德市人民东路388号,111.75546504063529,29.63944829501949
郴州市第一人民医院,湖南省郴州市北湖区罗家井102号,113.02863888540196,25.79167742954258
衡阳市中心医院,湖南省衡阳市雁城路12号,112.61008110500785,26.89393557719009
湖南省儿童医院,湖南省长沙市梓园路86号,112.9834214666401,28.177166604559797
湖南省妇幼保健院,湖南省长沙市湘春路23号,112.97762503216076,28.211392917174965
湖南省老年医院,湖南省长沙市马王堆路1号,113.02467976152715,28.210590273657246
湖南省脑科医院,湖南省长沙市雨花区赤岭路94号,112.97871637422415,28.159200437797207
湖南省人民医院（湖南师范大学第一附属医院）,湖南省长沙市解放西路61号,112.97558534461164,28.19451743412475
湖南省生殖保健医院,湖南省长沙市湘春路53号,112.97748021350941,28.2116990188983
湖南省中医学院附属二医院,湖南省长沙市蔡锷北路185号,112.97568412391925,28.205808031689394
湖南省中医学院附属一医院,湖南省长沙市雨花区韶山中路65号,112.98961671164831,28.166225116760742
湖南省中医研究院附属医院,湖南省长沙市麓山路58号,112.94367216794512,28.198948639096262
湖南省中医药研究院附属医院,湖南省长沙市岳麓区麓山南路273号,112.94127725224989,28.18117685140752
湖南省中医院（湖南中医药大学第二附属医院）,湖南省长沙市蔡锷北路233号,112.97568091201688,28.207169118855795
湖南省肿瘤医院,湖南省长沙市咸嘉湖582号,112.93215616335401,28.21863263265006
湖南中医学院第二附属医院,湖南省长沙市蔡锷北路233号,112.97559135843264,28.20716244893144
湖南中医药大学第一附属医院,湖南省长沙市雨花区韶山中路95号,112.98997694711868,28.168565429857505
怀化市第一人民医院（南华大学附属怀化医院）,湖南省怀化市锦溪南路144号,109.99380290079552,27.54756889149667
解放军第169医院,湖南省衡阳市海晖区东风南路369号,112.65874214766701,26.87386902525288
南华大学附属南华医院,衡阳市东风南路336号,112.65319597525202,26.87292444997286
娄底市中心医院,湖南省娄底市长青中街51号,112.01039566231096,27.734414519996843
南华大学附属第二医院（衡阳医学院第二附属医院）,湖南省衡阳市解放路30号,112.55470335890347,26.895736351718963
南华大学附属第三医院（湖南省结核病防治医院）,湖南省衡阳市南岳区衡山路169号,112.72653463117864,27.237560771514
南华大学附属第一医院（衡阳医学院第一附属医院）,湖南省衡阳市船山路69号,112.59625425360153,26.905690979688167
邵阳市中心医院,湖南省邵阳市红旗路乾元巷36号,111.45431834946565,27.236299264050878
湘潭市第一人民医院（南华大学附属湘潭医院、湘潭市肿瘤医院）,湖南省湘潭市岳塘区书院路21号,112.92290861284518,27.819966341308337
湘潭市中心医院,湖南省湘潭市雨湖区和平路120号,112.90683104198153,27.866110241687355
湘西土家族苗族自治州人民医院,湖南省吉首市厂坪路18号,109.73013811883645,28.31942940597954
益阳市第二人民医院,湖南省益阳市五一西路74号,112.32489849831083,28.59559525323572
益阳市第一人民医院,湖南省益阳市康复南路8号,112.34719095205855,28.57678234518712
益阳市中心医院,湖南省益阳市康复南路8号,112.34863425084632,28.57372292043934
益阳市中心医院益阳市第一人民医院（益阳地区人民医院）,湖南省益阳市康复南路8号,112.34863425084632,28.57372292043934
永州市中心医院（南华大学附属永州医院）,本部（北院） 湘 永州市冷水滩区逸云路396号，南院 湘 永州市零陵区潇水西路151号,111.62197343101519,26.424078960546638
岳阳市第一人民医院,湖南省岳阳市东茅岭路39号,113.10582159792409,29.375275034781772
中国人民解放军第163医院（湖南长沙163医院）,开福区洪山桥1号,113.01069525498055,28.248133142032863
中国人民解放军第一六三医院（湖南师范大学附属第二医院）,湖南省长沙洪山桥1号,113.01069525498055,28.248133142032863
中国人民解放军一六九中心医院,湖南省衡阳市珠晖区一六村1号,112.62484999896785,26.89096969338802
中南大学附属湘雅二医院（湘雅二院）,湖南省长沙市人民中路139号,112.98829912432109,28.191200619039453
中南大学附属湘雅三医院,湖南省长沙市河西桐梓坡路,112.93929778192769,28.22440595385612
中南大学湘雅二医院,湖南省长沙市人民中路139号,112.98829912432109,28.191200619039453
中南大学湘雅三医院,湖南省长沙市岳麓区桐梓坡路138号,112.93929778192769,28.22440595385612
中南大学湘雅医院,中国湖南长沙市湘雅路87号,112.97886153091778,28.21564190599408
株洲市第一医院,湖南省株洲市车站路24号,113.14880114144732,27.838499807989212
株洲市中医院（湖南中医药高等专科学校附属第一医院、湖南中医学院第三附属医院）,湖南株洲市人民路571号,113.13948944590518,27.85048496934028
北京大学深圳医院（深圳市中心医院、北大深圳医院）,广东省深圳市莲花北路1120号,114.04392104442294,22.5592297292574
潮州市中心医院（潮州红十字医院）,广东省潮州市环城西路84号,116.6383147820959,23.668922886705957
东莞东华医院,广东省东莞市东城东路1号,113.7809084682854,23.033581111598025
东莞康华医院,广东省东莞市东莞大道1000号（广深高速石鼓出入口处）,113.70435479514765,22.973897901034547
东莞市妇幼保健院,广东省东莞市城区运河东二路27号,113.74644631739028,23.046798906886433
东莞市厚街医院,广东省东莞市厚街镇河田路,113.66487866562275,22.935288857745377
东莞市人民医院,广东省东莞市万江区新谷涌万道路南3号,113.69406322745873,23.029078522911632
东莞市石龙人民医院（惠育医院）,广东省东莞市石龙镇中山西路34号,113.84827108163522,23.1157021586174
东莞市太平人民医院,广东省东莞市虎门镇虎门大道港口路段,113.67646851461885,22.823550482480073
东莞市中医院,广东省东莞市城区环城路61号,114.00809823048135,22.914916755978318
佛山市禅城区中心医院,广东省佛山市禅城区石湾三友南路,113.10614974138014,23.00146897983972
佛山市第二人民医院,广东省佛山市卫国路78号,113.11395414214235,23.02721365964215
佛山市第一人民医院,广东省佛山市领南大道北3号,113.2386377261499,22.871870017822
佛山市第一人民医院肿瘤医院（佛山市第四人民医院）,广东省佛山市金澜南路106号,113.10430553236279,22.98403526246048
佛山市妇幼保健院（广东省妇幼保健院佛山分院）,广东省佛山市禅城区人民西路11号,113.09992020694372,23.035339028126142
佛山市南海区妇幼保健院,广东省佛山市南海区桂平路,113.15367313482287,23.034477322227445
佛山市南海区人民医院,广东省佛山市南海区佛平路40号,113.12307901339018,23.034077102327842
佛山市顺德区第一人民医院,广东省佛山市顺德区大良区蓬莱路1号,113.24476331516134,22.84661772138661
佛山市中医院,广东省佛山市亲仁路6号,113.1041897503262,23.038512475818457
广东三九脑科医院（39脑科医院）,广东省广州市白云区沙太南路578号,113.32745789070499,23.179520186596037
广东省第二人民医院（解放军第一七七中心医院、177医院）,广东省广州市海珠区石榴岗路1号,113.32825118630466,23.097008110754818
广东省第二中医院,广东省广州市恒福路60号,113.27995839285518,23.14577693348096
广东省妇幼保健院,广东省广州市广园西路13号,113.24302118930125,23.15083590422954
广东省口腔医院,广东省广州市江南大道南366号,113.27170874107748,23.091680658962208
广东省人民医院,广东省广州市中山二路106号,113.28172639652077,23.128566162937062
广东省人民医院平洲分院（广东省医平洲分院）,广东省佛山市南海区平洲永安中路58号,113.19606447287813,23.02768769999705
广东省中医院（广州中医药大学第二附属医院、广州中医药大学第二临床医学院）,广东省广州市大德路111号,113.25088201398168,23.120229937725146
广东省中医院芳村分院（广州市慈善医院）,广东省广州市荔湾区芳村花地涌岸街36号,113.2216573879527,23.09999915557054
广东省中医院珠海医院,广东省珠海市景乐路53号,113.57332952336725,22.255018572530098
广东药学院附属第一医院,广东省广州东山农林下路19号,113.29053466392314,23.1301160163856
广东药学院附属第一医院激光整形美容中心（广州铁路中心医院激光整形美容中心）,广东省广州市农林下路19号广东药学院附属第一医院住院部急诊楼2楼,113.29053466392314,23.1301160163856
广州军区总医院（陆总医院）,广东省广州市流花路111号,113.24954996566895,23.14527977707393
广州市第八人民医院（广州市传染病医院）,广东省广州市东风东路627号,113.83736605405254,23.286883888058984
广州市第十二人民医院（广州市职业病防治院）,广东省广州市黄埔大道西天强路1号（中山一立交旁）,113.31305736031341,23.131874004516494
广州市第一人民医院,广东省广州市盘福路1号,113.25102648847474,23.133886775247184
广州市儿童医院（广州市妇女儿童医疗中心儿童医院院区）,广东省广州市人民中路318号,113.24834891417622,23.122342248317008
广州市番禺区人民医院（番禺中心医院）,广东省广州市番禺区桥南街福愉东路8号,113.37025075767191,22.913174907623784
广州市妇女儿童医疗中心珠江新城院区,广东省广州市金穗路9号,113.31473611696073,23.127557922797973
广州市妇婴医院（广州市妇幼保健院、广州市妇女儿童医疗中心市妇婴医院暨市妇幼保健院院区）,广东省广州市荔湾区人民中路402号,113.24898649854173,23.126395854119423
广州市红十字会医院（暨南大学医学院第四附属医院）,广东省广州市海珠区同福中路396号,113.25645366077651,23.107470008699877
广州市脑科医院（广州市精神病医院）,广东省广州市芳村区明心路36号,113.23497501344714,23.1013238556999
广州市脑科医院荔湾门诊部,广东省广州市荔湾区荔湾路53号,113.23481015056761,23.13438039855883
广州市胸科医院,广东省广州市横枝岗路62号,113.2833604068055,23.150483666682106
广州市中医医院,广东省广州市珠玑路16号,113.23830548528102,23.111850949964442
广州医学院第二附属医院（广医二院）,广东省广州市海珠区昌岗东路250号,113.2725509812911,23.09189263589
广州医学院第三附属医院（广州市第二人民医院）,广东省广州市荔湾区多宝路63号,113.22920355863089,23.11952080365716
广州医学院第一附属医院（广州市第四人民医院、广州市工人医院）,广东省广州市沿江路151号（原市总工会对面），广州市海珠区康大路1号,113.07125421375407,23.388069902069336
广州医学院口腔医院（广铁集团羊城铁路总公司广州医院）,广东省广州市荔湾区黄沙大道31号,113.22978729475496,23.114815165869356
广州中医药大学第一附属医院（广中医附一院）,广东省广州机场路16号大院,113.25909080572877,23.1596619872749
惠州市中心人民医院（广东医学院附属惠州医院）,广东省惠州市鹅岭北路41号,114.39415636877021,23.084494385846174
暨南大学附属第一医院（广州华侨医院）,广东省广州市黄埔大道西613号,113.34515695853185,23.12873264309673
江门市人民医院,广东省江门市蓬莱路高第里172号,113.08235332860808,22.583384931267187
江门市五邑中医院,广东省江门市华园东路30号,113.06959899558355,22.58063799469809
江门市中心医院,广东省江门市北街海旁街23号,113.10912053907992,22.60889101310901
开平市中心医院,广东省江门市开平区长沙三江开发区A7号,112.66365079384103,22.377071671364423
罗定市人民医院,广东省云浮市罗定市罗城镇陵园路34号,111.57105558990116,22.77246504894404
茂名市人民医院（广州银行医院、南方医科大学附属茂名医院）,广东省茂名市为民路101号,110.90539058910917,21.661123684942424
茂名市中医院,广东省茂名市油城五路7号,110.9151356944881,21.666647505755115
梅州市人民医院（梅州市黄塘医院）,广东省梅州市梅江区黄塘路,116.09462072369334,24.314493041308587
南方医科大学南方医院（南方医院）,广东省广州市广州大道北1838号,113.3241694422272,23.191414442939784
普宁市人民医院,广东省揭阳市普宁市流沙大道30号,116.12960796707077,23.30316723830294
清远市人民医院,广东省清远市清城区新城银泉南路B24号区,113.03079039647902,23.690240245411964
清远市中医院,广东省清远市清城区桥北路10号,113.03425142398106,23.711089607141968
汕头大学医学院第一附属医院,中国广东省汕头市长平路57号,116.70207921199625,23.365567184152805
汕头国际眼科中心（汕头大学医学院第五附属医院）,广东省汕头市东厦北路(广厦新城),116.71442185902325,23.396466476730836
韶关市第一人民医院,广东省韶关市东堤南路三十三号,113.59575885970332,24.808476453812094
韶关市粤北人民医院（汕头大学医学院附属粤北人民医院、粤北人民医院、韶关地区人民医院）,广东省韶关市惠民南路,113.58414588143414,24.79316456867227
深圳大学第一附属医院（深圳市第二人民医院）,广东省深圳市笋岗西路3002号,114.0805149364859,22.559846299523866
深圳市宝安区人民医院（深圳市第八人民医院、南方医科大学深圳宝安医院）,广东省深圳市宝安区龙井二路118号,113.90998198923181,22.56484077546957
深圳市妇幼保健院,广东省深圳市福田区红荔路2004号；福田区福强路3012号,114.08920338967643,22.552101491688646
深圳市南山区人民医院（深圳市第六人民医院）,广东省深圳市南山区桃园路89号,113.91869916416373,22.533806529816918
深圳市人民医院,广东省深圳市东门北路1017号,114.12362147579128,22.558599068128867
深圳市中医院,一门诊部地址：深圳市解放西路3015号 二门诊部地址：深圳市福华路1号,114.08037374511869,22.539762654641347
顺德区妇幼保健院,广东省佛山市顺德区大良区保健1号,113.25387934996733,22.834378972489137
武警广东省总队医院（武警广东总队医院、武警医院）,广东省广州市天河区燕岭路268号,113.3268023792038,23.165544767743494
阳江市人民医院,广东省阳江市江城区东山路42号,111.96597993187662,21.846298633507157
湛江市中心人民医院,广东省湛江市寸金路2号,110.34878680698581,21.27800054404722
肇庆市第一人民医院,广东省肇庆市城中路174号,112.45419524243619,23.049770797099693
肇庆市中医院,广东省肇庆市端州六路20号,112.449575320364,23.056150650783575
中国人民解放军第421医院,广东省广州市新港中路468号,113.33020796306451,23.09559228811536
中国人民解放军第一七三医院,广东省惠州市鹅岭南路20号,114.38793086406332,23.078586711976985
中国人民解放军第一五七医院（157陆军医院、157医院）,广东省广州市广州大道北梅花园白灰场路15号,113.3195845602308,23.189503753959134
中国人民解放军四五八医院（广州空军医院、解放军458医院）,广东省广州市东风东路801号,113.30670924591679,23.133925700799722
中山大学附属第二医院（中山二院、中山大学孙逸仙纪念医院）,广东省广州市沿江西路107号,113.25063996354311,23.11182963358375
中山大学附属第三医院（中山三院）,广东省广州市天河区天河路600号石牌岗顶,113.33573594841222,23.136757224545065
中山大学附属第五医院（中山五院）,广东省珠海市梅华东路52号,113.56826524049261,22.301443932592594
中山大学附属第一医院（中山一院）,广东省广州市中山二路58号,113.28576056388766,23.12900641637944
中山大学附属第一医院黄埔院区,广东省广州市黄埔东路183号,113.44820003903614,23.10414784014596
中山大学附属口腔医院（中山大学光华口腔医院）,广东省广州市陵园西路56号,113.2780659881247,23.133163718806237
中山大学附属汕头医院（汕头市中心医院）,广东省汕头市外马路114号,116.68930171102902,23.358635035275906
中山大学附属肿瘤医院（中山大学肿瘤防治中心、中山大学肿瘤研究所）,广东省广州市越秀区东风东路651号,113.30352104360688,23.133815470373126
中山大学中山眼科中心,广东省广州市先烈南路54号(近区庄立交桥东南侧),113.28736515111545,23.13595897533114
中山市博爱医院（中山市妇幼保健院）,广东省中山市城桂路6号,113.3862310190782,22.499909515323925
中山市人民医院（广东药学院附属中山医院）,广东省中山市孙文中路2号,113.37680792559897,22.528382537505284
中山市小榄人民医院,广东省中山市小榄镇竹源公路18号,113.22366323046415,22.679562526936273
中山市中医院（广州中医药大学中山附属医院）,广东省中山市西区康欣路3号（新院）,113.34852869447901,22.54106098326242
珠海市妇幼保健院,广东省珠海市香洲区柠溪路543号,113.55492722802117,22.2723425769485
珠海市人民医院（暨南大学医学院第三附属医院）,广东省珠海市康宁路79号,113.57076451380844,22.277628060855974
珠海市中医院,广东省珠海市吉大景乐路,113.57332952336725,22.255018572530098
珠江医院,广东省广州市工业大道中253号,113.26330870091975,23.084235396998555
百色地区人民医院,广西壮族自治区百色市城乡路8号,106.61726001594752,23.89529415992884
百色市人民医院,广西自治区百色市城乡路8号,106.61726001594752,23.89529415992884
北海市人民医院,广西壮族自治区北海市和平路83号,109.11213135866933,21.482481202495958
防城港市中医医院,广西防城港市防城区二桥东路8号,108.35894162024043,21.756651807721322
广西妇幼保健院,广西南宁市新阳路225号,108.28831929117675,22.82013564692513
广西骨伤医院,广西南宁新民路32号( 区公安厅旁 ),108.32607269642793,22.822528236237815
